{
  "schema_version": "1.0",
  "build_id": "rivet-intent-rover-001",
  "revision": 1,
  "project_family": "rover",
  "title": "Indoor obstacle rover",
  "source_intent_id": "intent-rover-001",
  "created_at": "2026-10-24T00:00:00Z",
  "status": "unbuildable",
  "components": [
    {
      "instance_id": "chassis-1",
      "catalog_id": "chassis.sparkfun_shadow_rob13301",
      "role": "chassis",
      "parent_instance_id": null,
      "attached_to_mount_id": null,
      "own_mount_id": null,
      "pose": {
        "position_mm": [
          0.0,
          52.5,
          0.0
        ],
        "rotation_deg": [
          0.0,
          0.0,
          0.0
        ]
      },
      "render_overrides": {}
    },
    {
      "instance_id": "motor-left-1",
      "catalog_id": "motor.adafruit_tt_gearbox_200rpm_3777",
      "role": "motor",
      "parent_instance_id": "chassis-1",
      "attached_to_mount_id": "motor_left",
      "own_mount_id": "base",
      "pose": {
        "position_mm": [
          -45.0,
          31.5,
          50.0
        ],
        "rotation_deg": [
          180.0,
          0.0,
          180.0
        ]
      },
      "render_overrides": {}
    },
    {
      "instance_id": "motor-right-1",
      "catalog_id": "motor.adafruit_tt_gearbox_200rpm_3777",
      "role": "motor",
      "parent_instance_id": "chassis-1",
      "attached_to_mount_id": "motor_right",
      "own_mount_id": "base",
      "pose": {
        "position_mm": [
          45.0,
          31.5,
          50.0
        ],
        "rotation_deg": [
          0.0,
          0.0,
          0.0
        ]
      },
      "render_overrides": {}
    },
    {
      "instance_id": "wheel-left-1",
      "catalog_id": "wheel.adafruit_tt_wheel_3766",
      "role": "wheel",
      "parent_instance_id": "motor-left-1",
      "attached_to_mount_id": "shaft",
      "own_mount_id": "hub",
      "pose": {
        "position_mm": [
          -68.5,
          31.5,
          50.0
        ],
        "rotation_deg": [
          180.0,
          0.0,
          180.0
        ]
      },
      "render_overrides": {}
    },
    {
      "instance_id": "wheel-right-1",
      "catalog_id": "wheel.adafruit_tt_wheel_3766",
      "role": "wheel",
      "parent_instance_id": "motor-right-1",
      "attached_to_mount_id": "shaft",
      "own_mount_id": "hub",
      "pose": {
        "position_mm": [
          68.5,
          31.5,
          50.0
        ],
        "rotation_deg": [
          0.0,
          0.0,
          0.0
        ]
      },
      "render_overrides": {}
    },
    {
      "instance_id": "caster-1",
      "catalog_id": "caster.sparkfun_shadow_nub",
      "role": "caster",
      "parent_instance_id": "chassis-1",
      "attached_to_mount_id": "caster_rear",
      "own_mount_id": "base",
      "pose": {
        "position_mm": [
          0.0,
          21.25,
          -80.0
        ],
        "rotation_deg": [
          0.0,
          0.0,
          0.0
        ]
      },
      "render_overrides": {}
    },
    {
      "instance_id": "controller-1",
      "catalog_id": "board.esp32_devkitc_v4_wroom32e",
      "role": "controller",
      "parent_instance_id": "chassis-1",
      "attached_to_mount_id": "controller_deck",
      "own_mount_id": "base",
      "pose": {
        "position_mm": [
          -25.0,
          102.95,
          30.0
        ],
        "rotation_deg": [
          0.0,
          0.0,
          0.0
        ]
      },
      "render_overrides": {}
    },
    {
      "instance_id": "driver-1",
      "catalog_id": "driver.adafruit_tb6612_2448",
      "role": "motor_driver",
      "parent_instance_id": "chassis-1",
      "attached_to_mount_id": "driver_deck",
      "own_mount_id": "base",
      "pose": {
        "position_mm": [
          30.0,
          98.0,
          30.0
        ],
        "rotation_deg": [
          0.0,
          0.0,
          0.0
        ]
      },
      "render_overrides": {}
    },
    {
      "instance_id": "sensor-1",
      "catalog_id": "sensor.adafruit_vl53l0x_3317",
      "role": "distance_sensor",
      "parent_instance_id": "chassis-1",
      "attached_to_mount_id": "front_sensor",
      "own_mount_id": "base",
      "pose": {
        "position_mm": [
          0.0,
          81.1,
          98.0
        ],
        "rotation_deg": [
          90.0,
          0.0,
          0.0
        ]
      },
      "render_overrides": {}
    },
    {
      "instance_id": "power-motor-1",
      "catalog_id": "power.sparkfun_shadow_4xaa_holder",
      "role": "motor_power",
      "parent_instance_id": "chassis-1",
      "attached_to_mount_id": "power_deck",
      "own_mount_id": "base",
      "pose": {
        "position_mm": [
          0.0,
          62.5,
          -40.0
        ],
        "rotation_deg": [
          0.0,
          0.0,
          0.0
        ]
      },
      "render_overrides": {}
    },
    {
      "instance_id": "power-control-1",
      "catalog_id": "power.adafruit_usb_power_bank_5000_4288",
      "role": "controller_power",
      "parent_instance_id": "chassis-1",
      "attached_to_mount_id": "power_usb",
      "own_mount_id": "base",
      "pose": {
        "position_mm": [
          0.0,
          102.75,
          -50.0
        ],
        "rotation_deg": [
          0.0,
          0.0,
          0.0
        ]
      },
      "render_overrides": {}
    },
    {
      "instance_id": "accessory-1",
      "catalog_id": "accessory.adafruit_half_breadboard_64",
      "role": "accessory",
      "parent_instance_id": "chassis-1",
      "attached_to_mount_id": null,
      "own_mount_id": null,
      "pose": {
        "position_mm": [
          0.0,
          52.5,
          0.0
        ],
        "rotation_deg": [
          0.0,
          0.0,
          0.0
        ]
      },
      "render_overrides": {
        "visible": false
      }
    },
    {
      "instance_id": "accessory-2",
      "catalog_id": "wiring.adafruit_jumper_mm_40x150_758",
      "role": "accessory",
      "parent_instance_id": "chassis-1",
      "attached_to_mount_id": null,
      "own_mount_id": null,
      "pose": {
        "position_mm": [
          0.0,
          52.5,
          0.0
        ],
        "rotation_deg": [
          0.0,
          0.0,
          0.0
        ]
      },
      "render_overrides": {
        "visible": false
      }
    },
    {
      "instance_id": "accessory-3",
      "catalog_id": "wiring.adafruit_stemma_qt_to_male_4209",
      "role": "accessory",
      "parent_instance_id": "chassis-1",
      "attached_to_mount_id": null,
      "own_mount_id": null,
      "pose": {
        "position_mm": [
          0.0,
          52.5,
          0.0
        ],
        "rotation_deg": [
          0.0,
          0.0,
          0.0
        ]
      },
      "render_overrides": {
        "visible": false
      }
    },
    {
      "instance_id": "accessory-4",
      "catalog_id": "wiring.adafruit_usb_a_microb_3ft_592",
      "role": "accessory",
      "parent_instance_id": "chassis-1",
      "attached_to_mount_id": null,
      "own_mount_id": null,
      "pose": {
        "position_mm": [
          0.0,
          52.5,
          0.0
        ],
        "rotation_deg": [
          0.0,
          0.0,
          0.0
        ]
      },
      "render_overrides": {
        "visible": false
      }
    },
    {
      "instance_id": "accessory-5",
      "catalog_id": "accessory.adafruit_dc_jack_terminal_368",
      "role": "accessory",
      "parent_instance_id": "chassis-1",
      "attached_to_mount_id": null,
      "own_mount_id": null,
      "pose": {
        "position_mm": [
          0.0,
          52.5,
          0.0
        ],
        "rotation_deg": [
          0.0,
          0.0,
          0.0
        ]
      },
      "render_overrides": {
        "visible": false
      }
    },
    {
      "instance_id": "accessory-6",
      "catalog_id": "accessory.adafruit_aa_alkaline_4pack_3349",
      "role": "accessory",
      "parent_instance_id": "chassis-1",
      "attached_to_mount_id": null,
      "own_mount_id": null,
      "pose": {
        "position_mm": [
          0.0,
          52.5,
          0.0
        ],
        "rotation_deg": [
          0.0,
          0.0,
          0.0
        ]
      },
      "render_overrides": {
        "visible": false
      }
    }
  ],
  "connections": [
    {
      "connection_id": "wire-motor-left-pwm",
      "kind": "electrical",
      "from": {
        "instance_id": "controller-1",
        "port_id": "gpio25"
      },
      "to": {
        "instance_id": "driver-1",
        "port_id": "pwma"
      },
      "net_name": "MOTOR_LEFT_PWM",
      "notes": null
    },
    {
      "connection_id": "wire-motor-left-in1",
      "kind": "electrical",
      "from": {
        "instance_id": "controller-1",
        "port_id": "gpio26"
      },
      "to": {
        "instance_id": "driver-1",
        "port_id": "ain1"
      },
      "net_name": "MOTOR_LEFT_IN1",
      "notes": null
    },
    {
      "connection_id": "wire-motor-left-in2",
      "kind": "electrical",
      "from": {
        "instance_id": "controller-1",
        "port_id": "gpio27"
      },
      "to": {
        "instance_id": "driver-1",
        "port_id": "ain2"
      },
      "net_name": "MOTOR_LEFT_IN2",
      "notes": null
    },
    {
      "connection_id": "wire-motor-right-pwm",
      "kind": "electrical",
      "from": {
        "instance_id": "controller-1",
        "port_id": "gpio32"
      },
      "to": {
        "instance_id": "driver-1",
        "port_id": "pwmb"
      },
      "net_name": "MOTOR_RIGHT_PWM",
      "notes": null
    },
    {
      "connection_id": "wire-motor-right-in1",
      "kind": "electrical",
      "from": {
        "instance_id": "controller-1",
        "port_id": "gpio33"
      },
      "to": {
        "instance_id": "driver-1",
        "port_id": "bin1"
      },
      "net_name": "MOTOR_RIGHT_IN1",
      "notes": null
    },
    {
      "connection_id": "wire-motor-right-in2",